{"$defs":{"SourceDescriptor":{"additionalProperties":false,"properties":{"applicability_scope":{"additionalProperties":true,"title":"Applicability Scope","type":"object"},"content_sha256":{"pattern":"^sha256:[0-9a-f]{64}$","title":"Content Sha256","type":"string"},"corpus_mode":{"const":"demo","title":"Corpus Mode","type":"string"},"demo_company":{"const":true,"title":"Demo Company","type":"boolean"},"document_version":{"maxLength":80,"minLength":1,"pattern":"^[A-Za-z0-9][A-Za-z0-9._:-]{0,79}$","title":"Document Version","type":"string"},"effective_date":{"anyOf":[{"format":"date","pattern":"^\\d{4}-\\d{2}-\\d{2}$","type":"string"},{"type":"null"}],"default":null,"title":"Effective Date"},"license":{"const":"CC0-1.0","title":"License","type":"string"},"path":{"maxLength":500,"minLength":1,"title":"Path","type":"string"},"provenance_status":{"const":"reviewed","title":"Provenance Status","type":"string"},"revision_date":{"anyOf":[{"format":"date","pattern":"^\\d{4}-\\d{2}-\\d{2}$","type":"string"},{"type":"null"}],"default":null,"title":"Revision Date"},"source_class":{"enum":["company_rule","company_reference"],"title":"Source Class","type":"string"},"source_id":{"maxLength":160,"minLength":1,"pattern":"^[A-Za-z0-9][A-Za-z0-9._:-]{0,159}$","title":"Source Id","type":"string"},"source_title":{"maxLength":300,"minLength":1,"title":"Source Title","type":"string"},"source_type":{"maxLength":80,"minLength":1,"pattern":"^[A-Za-z0-9][A-Za-z0-9._:-]{0,79}$","title":"Source Type","type":"string"},"source_uri":{"maxLength":500,"minLength":8,"pattern":"^demo://[^@?#]+$","title":"Source Uri","type":"string"},"synthetic":{"const":true,"title":"Synthetic","type":"boolean"},"visibility_scope":{"$ref":"#/$defs/VisibilityScope"}},"required":["source_id","path","source_uri","source_title","source_type","source_class","document_version","applicability_scope","visibility_scope","content_sha256","license","provenance_status","synthetic","demo_company","corpus_mode"],"title":"SourceDescriptor","type":"object"},"VisibilityScope":{"additionalProperties":false,"properties":{"roles":{"items":{"enum":["Executive","HRAdmin","HRPractitioner","Employee"],"type":"string"},"maxItems":4,"minItems":1,"title":"Roles","type":"array"}},"required":["roles"],"title":"VisibilityScope","type":"object"}},"$id":"https://ax.local/contracts/ax-synthetic-seed-content-v1.schema.json","$schema":"https://json-schema.org/draft/2020-12/schema","additionalProperties":false,"properties":{"corpus_id":{"maxLength":160,"minLength":1,"pattern":"^[A-Za-z0-9][A-Za-z0-9._:-]{0,159}$","title":"Corpus Id","type":"string"},"corpus_mode":{"const":"demo","title":"Corpus Mode","type":"string"},"corpus_version":{"maxLength":80,"minLength":1,"pattern":"^[A-Za-z0-9][A-Za-z0-9._:-]{0,79}$","title":"Corpus Version","type":"string"},"demo_company":{"const":true,"title":"Demo Company","type":"boolean"},"license":{"const":"CC0-1.0","title":"License","type":"string"},"provenance_status":{"const":"reviewed","title":"Provenance Status","type":"string"},"schema_version":{"const":"ax-synthetic-seed-content-v1","title":"Schema Version","type":"string"},"sealed_content_digest":{"pattern":"^sha256:[0-9a-f]{64}$","title":"Sealed Content Digest","type":"string"},"sources":{"items":{"$ref":"#/$defs/SourceDescriptor"},"maxItems":200,"minItems":1,"title":"Sources","type":"array"},"synthetic":{"const":true,"title":"Synthetic","type":"boolean"}},"required":["schema_version","corpus_id","corpus_version","synthetic","demo_company","corpus_mode","license","provenance_status","sources","sealed_content_digest"],"title":"AX Synthetic Seed Pack v1 corpus manifest","type":"object","x-ax-directory-file":"corpus-manifest.json"}
